### ISSUE TITLE
nginx sends RST on nearly every connection close — lingering_close always eliminates it at no measurable cost

### ISSUE THREAD

**Issue by Giuseppe-TD** [ZoeyVid/NPMplus#3630]
## Summary

While investigating an unrelated problem I captured traffic on my NPMplus instance and found that nginx sends a TCP RST on nearly every connection close, immediately after the response has been fully delivered. Adding `lingering_close always;` to the proxy host server blocks eliminated it completely, with no measurable cost in socket usage.

I am not reporting this as a bug — everything still works — but the behaviour is not what stock nginx does, and I would like to understand whether it is intentional.

## Environment

- NPMplus `latest`, deployed via docker compose, `network_mode: host`
- Debian LXC (unprivileged) on Proxmox VE, kernel 7.0.14-4-pve
- ~60 proxy hosts, WordPress/Joomla backends over plain HTTP (`proxy_pass http://...`)
- HTTP/2 and HTTP/3 enabled, Let's Encrypt certificates via certbot

## Observation

Packet capture on the proxy, filtered on a single remote client:

```
10:31:10.274136 In  IP client.51090 > proxy.443: Flags [S],   seq 782825596
10:31:10.274184 Out IP proxy.443 > client.51090: Flags [S.],  seq 3114891035, ack 782825597
10:31:10.418185 Out IP proxy.443 > client.51090: Flags [FP.], seq 58430:61045, ack 1949, length 2615
10:31:10.437353 Out IP proxy.443 > client.51090: Flags [R],   seq 3114952081, win 0, length 0
```

The RST signature is consistent across every occurrence:

- `Flags [R]`, `win 0`, **no ACK flag**
- sequence number exactly equal to `snd_nxt` (end of data plus the FIN)
- roughly 20 ms after the FIN, which matches one RTT to that client

Rate: approximately 10 RST per minute toward a single monitoring client performing one request every 2–3 minutes across ~34 endpoints. Essentially every closed connection produced one.

## Mechanism

This is the signature of `tcp_send_active_reset()`: the kernel emits it when data arrives on a socket the application has already fully closed.

1. nginx finishes writing the response and calls `close()` — the last chunk goes out with the FIN attached
2. one RTT later the client sends its TLS `close_notify` (24 bytes — visible in the capture as the client FIN carrying `seq 25`)
3. those bytes arrive on a socket that no longer has an owner
4. the kernel replies RST

The relevant consequence is on the client side: when a TCP stack receives an RST, it **discards any data still sitting in the receive buffer that the application has not read yet**. For a fast reader this is harmless. For a client that has not drained the socket at that instant, the tail of the response disappears.

## Fix and measured effect

Added to a file included in every proxy host `server` block (`/data/custom_nginx/server_proxy.conf`):

```nginx
lingering_close always;
lingering_timeout 2s;
```

`lingering_timeout` is lowered from the 5s default purely as a safety margin: it caps how long nginx will wait for residual bytes from a client that opens and disappears without closing. It does not affect the normal path — as shown in the capture, the client FIN arrives about 20 ms after the server FIN, so nginx closes immediately and never reaches the timeout.

RST count per minute, outbound, same capture filter, same client:

```
before          after
10:21  7        10:37  0
10:22  10       10:38  0
10:23  12       ...
10:24  9        11:49  0
10:25  11       11:50  0
10:26  9
...
10:35  11
10:36  4   <-- reload applied
```

Zero RST over 90 minutes, against roughly 900 expected at the previous rate. The capture was verified live throughout (20–30 packets/minute continuing to be recorded), and the disappearance was confirmed independently from the remote endpoint 1,500 km away, which had been receiving 7–14 RST per minute before the change and none after.

## Cost

This was the part I expected to hurt, since `lingering_close` keeps the socket alive to drain residual bytes. Sampled every 10 minutes on the proxy LXC:

| metric | before | after |
|---|---|---|
| ESTAB | 79–118 | 79–118 |
| FIN-WAIT-2 | 0–1 | 0–1 |
| TIME-WAIT | 216–378 | 214–378 |
| CLOSING | 0–1 | 3–5 |
| conntrack | 658 / 262144 | unchanged |

No accumulation. The only movement is `CLOSING`, which is the expected signature of simultaneous close and is benign — those same connections previously ended in RST.

The reason the cost stays near zero is visible in the capture: the client FIN arrives about 20 ms after the server FIN, so nginx closes almost immediately and the `lingering_timeout` is never reached in practice. It only bounds the pathological case of a client that never closes at all.

(The figures above were measured with the 5s default; `lingering_timeout 2s` was added afterwards as a precaution and can only reduce these numbers further.)

## What this did not fix

For completeness, since it may save someone else the time: the symptom that started this investigation was intermittent false `response stream aborted` / `timeout of 48000ms exceeded` on Uptime Kuma monitors. **Removing the RST did not fix that.** It traced back to ordinary internet packet loss (~0.04%, measured at 4 slow handshakes in 10,000 sequential curl requests) combined with tail-loss RTO backoff exceeding the client timeout. Unrelated to nginx.

So `lingering_close always` should be evaluated on its own merits — protocol correctness — not as a fix for monitoring false positives.

## Questions

1. **`reset_timedout_connection on`** is set at line 38 of `/usr/local/nginx/conf/nginx.conf`. nginx defaults this to `off`. Is this deliberate — presumably to free socket memory quickly under scanner load? Worth noting that setting it to `off` did **not** change the RST behaviour described above, because these connections are not timing out, they are closing normally. So the two are separate matters; I mention it only because it was the first thing I looked at.

2. Would `lingering_close always` be a reasonable default for proxy hosts? The measurements above suggest the cost is negligible at moderate connection rates, though I recognise it may not hold for deployments facing much higher volumes of abandoned connections.

Happy to provide the full captures or run additional tests.

latest versione from 23-07-2026

**Comment by Zoey2936** [comment]
are you sure that this also happens with a vanilla nginx build and config?

**Comment by Giuseppe-TD** [comment]
Good question — I just tested it. Same host environment (Debian LXC on Proxmox, same kernel), official `nginx:latest` Docker image, stock config, self-signed cert, ~93 KB response, 20 sequential HTTPS requests, capture filtered on FIN/RST:

```
20 connections, 40 packets captured: all FIN. Zero RST.
```

Every connection closes cleanly — client FIN, server FIN-ACK, done. Example:

```
21:59:22.911747 In  IP client.44236 > server.8443: Flags [F.], seq 858, ack 95647
21:59:22.912070 Out IP server.8443 > client.44236: Flags [F.], seq 95647, ack 859
```

On NPMplus, the same client and the same capture filter showed an outbound RST on essentially every connection close (roughly 10/min under monitoring load), with the signature described above — `seq = snd_nxt`, `win 0`, no ACK flag, ~1 RTT after the server's FIN.

Caveats for fairness: the vanilla test ran over LAN (near-zero RTT) with curl closing politely, while the original observation was over WAN (~20 ms RTT). But in the vanilla case the server never even initiates the abrupt close-then-RST sequence, so the difference in behaviour is upstream of timing.

So: reproducible on NPMplus, not reproducible on vanilla nginx with default config on the same host. Happy to run any variant you'd like (specific config directives, your build with a stock config, etc.) to narrow down where the difference comes from.

**Comment by Zoey2936** [comment]
what nginx version have you used for testing?

**Comment by Giuseppe-TD** [comment]
Latest tag

**Comment by Zoey2936** [comment]
I mean which nginx version for the test against vanilla nginx

**Comment by Giuseppe-TD** [comment]
Both are **nginx/1.31.3**:

- Vanilla test: official `nginx:latest` Docker image (digest `5a88c9c45479...`), reports `nginx/1.31.3`
- NPMplus: reports `nginx/1.31.3 (NPMplus)`

Same version, same host, same kernel — vanilla closes every connection with a clean FIN exchange, NPMplus sends the RST. So the difference is either in the build (patches/TLS library) or in the generated configuration, not in the nginx version itself.

Happy to bisect further if useful — e.g. running the NPMplus binary with a minimal stock config, or vanilla with your generated config, to isolate which side it comes from.

**Comment by Zoey2936** [comment]
can you share the curl commands you used? (and the curl -V output)

**Comment by Giuseppe-TD** [comment]
Sure.

**Vanilla test** — loop from a LAN client against the official `nginx:latest` container (self-signed cert, ~93 KB response):

```bash
for i in $(seq 1 20); do curl -sk https://<vanilla-host>:8443/ -o /dev/null; sleep 2; done
```

Capture on the vanilla host, running before and during the loop:

```bash
tcpdump -i any -nn -tttt "port 8443 and tcp[tcpflags] & (tcp-fin|tcp-rst) != 0"
```

Result: 20 connections, 40 packets, all FIN — zero RST.

**Original observation on NPMplus** — the client was a remote host (~20 ms RTT) running both Uptime Kuma monitors (axios/Node) and plain sequential curl loops:

```bash
for i in $(seq 1 10000); do curl -so /dev/null -w '%{http_code} %{time_total}\n' --max-time 48 https://<proxied-domain>/; done
```

with the RSTs visible in a capture on the proxy filtered on that client's IP. The RST shows up with both axios and curl as clients, so it's not a client-side artifact.

`curl -V` on the remote client (the one used for the 10k-request loop):

```
curl 8.5.0 (x86_64-pc-linux-gnu) libcurl/8.5.0 OpenSSL/3.0.13 zlib/1.3 brotli/1.1.0 zstd/1.5.5 libidn2/2.3.7 libpsl/0.21.2 (+libidn2/2.3.7) libssh/0.10.6/openssl/zlib nghttp2/1.59.0 librtmp/2.3 OpenLDAP/2.6.7
Release-Date: 2023-12-06, security patched: 8.5.0-2ubuntu10.11
Protocols: dict file ftp ftps gopher gophers http https imap imaps ldap ldaps mqtt pop3 pop3s rtmp rtsp scp sftp smb smbs smtp smtps telnet tftp
Features: alt-svc AsynchDNS brotli GSS-API HSTS HTTP2 HTTPS-proxy IDN IPv6 Kerberos Largefile libz NTLM PSL SPNEGO SSL threadsafe TLS-SRP UnixSockets zstd
```

The LAN client for the vanilla test was a different machine (Debian LXC, distro curl), but in that test the server never initiated the close-then-RST sequence at all, so the client version shouldn't matter there. Happy to re-run the vanilla test from the same remote client over WAN if you want a fully symmetric comparison.

**Comment by Zoey2936** [comment]
Thanks! Yes it would be usefull if you could test NPMplus with the same nginx.conf. And for both tests: have you used network_mode host for both?

**Comment by Giuseppe-TD** [comment]
Re-ran the test properly (server-side close forced with `curl -H "Connection: close"`, host networking on both sides, identical stock config for both nginx builds, ~92 KB response, 20 connections each):

```
Vanilla nginx:latest (1.31.3):  40 RST / 20 connections
NPMplus binary, same config:    39 RST / 20 connections
```

Identical behaviour. So the RST is **stock nginx**, not something NPMplus does — it happens whenever nginx closes a keepalive TLS connection first and the client's `close_notify` lands on the already-closed socket. My earlier "vanilla is clean" result was wrong: it used client-first close, so the server never entered the close-first path.

`lingering_close always` eliminates it on both. So it may still be worth considering as a proxy-host default, but the framing is different — it's a general nginx TLS-close trait, not an NPMplus regression. Sorry for the earlier misdiagnosis.

**Comment by Zoey2936** [comment]
I thought a bit about this and decided to leave this option like it currently is. Since you mentioned Uptime Kuma, I'm using it myself and for me it works fine
